<?xml version="1.0" encoding="UTF-8"?>
<!DOCTYPE profile SYSTEM "profile.dtd">
<Profile>
	<DNI>05692939W</DNI>
	<Name>Sergio</Name>
	<Surname>de la Rubia</Surname>
	<Address>
		<Street>C/Pedro Oviedo</Street>
		<Number>36</Number>
		<ZipCode>13270</ZipCode>
		<Town>Almagro</Town>
		<State>Ciudad Real</State>
	</Address>
</Profile>
